{
  "$schema": "https://json-schema.org/draft/2020-12/schema",
  "$id": "https://sporespore.local/schemas/lab/br11_milestone_decision_v1.schema.json",
  "title": "SporeSpore BR11 milestone decision v1",
  "description": "Append-only human decision over one exact BR11 certification. It cannot erase the material planar scaffold, turn a kinetic proxy into injury prediction, convert a local core witness into measured allocation, promote BR11.4, admit knowledge, authorize guidance, or broaden the certified claim.",
  "type": "object",
  "additionalProperties": false,
  "required": [
    "schema",
    "decision_id",
    "milestone_id",
    "decision_revision",
    "status",
    "decided_by",
    "authorization",
    "decided_utc",
    "evidence_basis",
    "accepted_contracts",
    "accepted_capabilities",
    "supplementary_constraints",
    "claim_boundary",
    "excluded_capabilities",
    "downstream_open",
    "knowledge_effects",
    "supersedes"
  ],
  "properties": {
    "schema": {
      "const": "sporespore.lab.br11_milestone_decision.v1"
    },
    "decision_id": {
      "const": "BR11_CONTROLLED_PLANAR_FALL_DECISION_V1"
    },
    "milestone_id": {
      "const": "BR11_CONTROLLED_PLANAR_FALL"
    },
    "decision_revision": {
      "const": 1
    },
    "status": {
      "enum": ["accepted", "rejected", "retired"]
    },
    "decided_by": {
      "$ref": "#/$defs/decider"
    },
    "authorization": {
      "$ref": "#/$defs/authorization"
    },
    "decided_utc": {
      "type": "string",
      "format": "date-time"
    },
    "evidence_basis": {
      "$ref": "#/$defs/evidence_basis"
    },
    "accepted_contracts": {
      "type": "array",
      "minItems": 1,
      "uniqueItems": true,
      "items": {
        "type": "string",
        "pattern": "^[a-z][a-z0-9_]*_v[0-9]+$"
      }
    },
    "accepted_capabilities": {
      "$ref": "#/$defs/nonempty_unique_strings"
    },
    "supplementary_constraints": {
      "$ref": "#/$defs/nonempty_unique_strings"
    },
    "claim_boundary": {
      "type": "string",
      "minLength": 1
    },
    "excluded_capabilities": {
      "$ref": "#/$defs/nonempty_unique_strings"
    },
    "downstream_open": {
      "$ref": "#/$defs/nonempty_unique_strings"
    },
    "knowledge_effects": {
      "$ref": "#/$defs/knowledge_effects"
    },
    "supersedes": {
      "type": "array",
      "uniqueItems": true,
      "items": {
        "type": "string",
        "pattern": "^[A-Z0-9_]+_DECISION_V[0-9]+$"
      }
    }
  },
  "$defs": {
    "sha256": {
      "type": "string",
      "pattern": "^sha256:[a-f0-9]{64}$"
    },
    "git_sha": {
      "type": "string",
      "pattern": "^[a-f0-9]{40}$"
    },
    "nonempty_unique_strings": {
      "type": "array",
      "minItems": 1,
      "uniqueItems": true,
      "items": {
        "type": "string",
        "minLength": 1
      }
    },
    "decider": {
      "type": "object",
      "additionalProperties": false,
      "required": ["id", "authority", "decision_channel"],
      "properties": {
        "id": {
          "const": "Cole"
        },
        "authority": {
          "const": "project_decider"
        },
        "decision_channel": {
          "const": "direct_conversation"
        }
      }
    },
    "authorization": {
      "type": "object",
      "additionalProperties": false,
      "required": [
        "instruction",
        "interpretation",
        "review_path",
        "review_commit_sha",
        "review_sha256"
      ],
      "properties": {
        "instruction": {
          "type": "string",
          "minLength": 1
        },
        "interpretation": {
          "const": "delegated_bounded_acceptance_of_recommended_br11_controlled_planar_fall"
        },
        "review_path": {
          "const": "docs/BR11_CONTROLLED_FALL_MILESTONE_DECISION_REVIEW.md"
        },
        "review_commit_sha": {
          "$ref": "#/$defs/git_sha"
        },
        "review_sha256": {
          "$ref": "#/$defs/sha256"
        }
      }
    },
    "evidence_basis": {
      "type": "object",
      "additionalProperties": false,
      "required": [
        "evidence_family",
        "certification_id",
        "certification_contract_id",
        "campaign_id",
        "campaign_sha256",
        "certification_claim_boundary",
        "report_schema",
        "report_status",
        "report_sha256",
        "report_bytes",
        "report_locator",
        "report_generated_utc",
        "receipt_schema",
        "receipt_sha256",
        "receipt_locator",
        "receipt_attested_utc",
        "receipt_key_id",
        "source_commit_sha",
        "source_inventory_sha256",
        "source_file_count",
        "br1_inventory_sha256",
        "br1_inventory_unchanged",
        "engine_version",
        "engine_sha256",
        "programs_required",
        "programs_passed",
        "replicates_per_program",
        "bundles_required",
        "bundles_passed",
        "assertions_required",
        "assertions_passed",
        "milestone_programs",
        "milestone_assertions",
        "supplementary_programs",
        "supplementary_assertions",
        "integrity_programs",
        "integrity_assertions",
        "target_process_invocations",
        "unique_target_processes",
        "pid_recycle_events",
        "receipts_verified",
        "production_attestation_verified"
      ],
      "properties": {
        "evidence_family": {
          "const": "br11_certification_report_v1"
        },
        "certification_id": {
          "const": "br11_20260723T195911Z_d4551f99"
        },
        "certification_contract_id": {
          "const": "BR11_CONTROLLED_PLANAR_FALL"
        },
        "campaign_id": {
          "const": "BR11_CONTROLLED_FALL_PROMOTION_CAMPAIGN_V1"
        },
        "campaign_sha256": {
          "$ref": "#/$defs/sha256"
        },
        "certification_claim_boundary": {
          "type": "string",
          "minLength": 1
        },
        "report_schema": {
          "const": "sporespore.lab.br11_certification_report.v1"
        },
        "report_status": {
          "const": "pass"
        },
        "report_sha256": {
          "$ref": "#/$defs/sha256"
        },
        "report_bytes": {
          "const": 26509
        },
        "report_locator": {
          "const": "LabEvidence/BR11/br11_20260723T195911Z_d4551f99/br11_certification_report.json"
        },
        "report_generated_utc": {
          "const": "2026-07-23T20:00:35.1281841Z"
        },
        "receipt_schema": {
          "const": "sporespore.lab.br11_certification_report_attestation.v1"
        },
        "receipt_sha256": {
          "$ref": "#/$defs/sha256"
        },
        "receipt_locator": {
          "const": "LabTrust/v1/br11_certification_reports_v1/receipts/e7fa407f1b273ee79221a37d21d08335a20105660c176ee741de24883258d151.json"
        },
        "receipt_attested_utc": {
          "const": "2026-07-23T20:00:43Z"
        },
        "receipt_key_id": {
          "$ref": "#/$defs/sha256"
        },
        "source_commit_sha": {
          "const": "d4551f99ce0260ac901ca682e0237e81e38df3d8"
        },
        "source_inventory_sha256": {
          "$ref": "#/$defs/sha256"
        },
        "source_file_count": {
          "const": 392
        },
        "br1_inventory_sha256": {
          "$ref": "#/$defs/sha256"
        },
        "br1_inventory_unchanged": {
          "const": true
        },
        "engine_version": {
          "const": "4.7.stable.mono.official.5b4e0cb0f"
        },
        "engine_sha256": {
          "$ref": "#/$defs/sha256"
        },
        "programs_required": {
          "const": 5
        },
        "programs_passed": {
          "const": 5
        },
        "replicates_per_program": {
          "const": 2
        },
        "bundles_required": {
          "const": 10
        },
        "bundles_passed": {
          "const": 10
        },
        "assertions_required": {
          "const": 208
        },
        "assertions_passed": {
          "const": 208
        },
        "milestone_programs": {
          "const": 4
        },
        "milestone_assertions": {
          "const": 122
        },
        "supplementary_programs": {
          "const": 0
        },
        "supplementary_assertions": {
          "const": 0
        },
        "integrity_programs": {
          "const": 1
        },
        "integrity_assertions": {
          "const": 86
        },
        "target_process_invocations": {
          "const": 10
        },
        "unique_target_processes": {
          "const": 10
        },
        "pid_recycle_events": {
          "const": 0
        },
        "receipts_verified": {
          "const": 10
        },
        "production_attestation_verified": {
          "const": true
        }
      }
    },
    "knowledge_effects": {
      "type": "object",
      "additionalProperties": false,
      "required": [
        "entries_admitted_by_decision",
        "automatic_admission",
        "automatic_creature_guidance_allowed",
        "development_drafts_remain_non_entries"
      ],
      "properties": {
        "entries_admitted_by_decision": {
          "const": 0
        },
        "automatic_admission": {
          "const": false
        },
        "automatic_creature_guidance_allowed": {
          "const": false
        },
        "development_drafts_remain_non_entries": {
          "const": true
        }
      }
    }
  }
}

